region,"an area, especially part of a country or the world having definable characteristics but not always fixed boundaries."
relate,make or show a connection between.
relief,a feeling of reassurance and relaxation following release from anxiety or distress.
remain,"continue to exist, especially after other similar people or things have ceased to do so."
remote,(of a place) situated far from the main centres of population; distant.
remove,take (something) away or off from the position occupied.
repair,"restore (something damaged, faulty, or worn) to a good condition."
repeat,say again something one has already said.
replay,"play back (a recording on tape, video, or film)."
report,"give a spoken or written account of something that one has observed, heard, done, or investigated."
rescue,save (someone) from a dangerous or difficult situation.
resort,a place that is frequented for holidays or recreation or for a particular purpose.
result,a thing that is caused or produced by something else; a consequence or outcome.
retail,the sale of goods to the public in relatively small quantities for use or consumption rather than for resale.
retain,continue to have (something); keep possession of.
return,come or go back to a place or person.
reveal,make (previously unknown or secret information) known to others.
review,a formal assessment of something with the intention of instituting change if necessary.
reward,"a thing given in recognition of service, effort, or achievement."
riding,the sport or activity of riding horses.
rising,"going up, increasing, or sloping upward."
robust,strong and healthy; vigorous.
ruling,"an authoritative decision or pronouncement, especially one made by a judge."
safety,"the condition of being protected from or unlikely to cause danger, risk, or injury."
salary,"a fixed regular payment, typically paid on a monthly basis but often expressed as an annual sum, made by an employer to an employee, especially a professional or white-collar worker."
sample,a small part or quantity intended to show what the whole is like.
saving,"an economy of or reduction in money, time, or another resource."
saying,"a short, pithy, commonly known expression which generally offers advice or wisdom."
scheme,a large-scale systematic plan or arrangement for attaining a particular object or putting a particular idea into effect.
school,an institution for educating children.
screen,"a fixed or movable upright partition used to divide a room, give shelter from draughts, heat, or light, or to provide concealment or privacy."
search,try to find something by looking or otherwise seeking carefully and thoroughly.
season,a set or sequence of related television programmes; a series.
second,constituting number two in a sequence; coming after the first in time or order; 2nd.
secret,not known or seen or not meant to be known or seen by others.
sector,an area or portion that is distinct from others.
secure,"fixed or fastened so as not to give way, become loose, or be lost."
seeing,because; since.
select,carefully choose as being the best or most suitable.
seller,a person who sells something.
senior,of or for older or more experienced people.
series,"a number of events, objects, or people of a similar or related kind coming one after another."
server,a computer or computer program which manages access to a centralized resource or service in a network.
settle,resolve or reach an agreement about (an argument or problem).
severe,(of something bad or undesirable) very great; intense.
sexual,"relating to the instincts, physiological processes, and activities connected with physical attraction or intimate physical contact between individuals."
should,"used to indicate obligation, duty, or correctness, typically when criticizing someone's actions."
signal,"a gesture, action, or sound that is used to convey information or instructions, typically by prearrangement between the parties concerned."
signed,"write one's name on (a letter, card, document, etc.) to identify oneself as the writer or sender."
silent,not making or accompanied by any sound.
silver,a shiny grey-white colour or appearance like that of silver.
simple,easily understood or done; presenting no difficulty.
simply,in a straightforward or plain manner.
single,only one; not one of several.
sister,a woman or girl in relation to other daughters and sons of her parents.
slight,small in degree; inconsiderable.
smooth,"having an even and regular surface; free from perceptible projections, lumps, or indentations."
social,relating to society or its organization.
solely,not involving anyone or anything else; only.
sought,attempt to find (something).
source,"a place, person, or thing from which something originates or can be obtained."
soviet,of or concerning the former Soviet Union.
speech,the expression of or the ability to express thoughts and feelings by articulate sounds.
spirit,the non-physical part of a person which is the seat of emotions and character; the soul.
spoken,speaking in a specified way.
spread,"open out (something) so as to extend its surface area, width, or length."
spring,move or jump suddenly or rapidly upwards or forwards.
square,a plane figure with four equal straight sides and four right angles.
stable,(of an object or structure) not likely to give way or overturn; firmly fixed.
status,relative social or professional position; standing.
steady,"firmly fixed, supported, or balanced; not shaking or moving."
stolen,take (another person's property) without permission or legal right and without intending to return it.
strain,force (a part of one's body or oneself) to make an unusually great effort.
stream,"a small, narrow river."
street,"a public road in a city, town, or village, typically with houses and buildings on one or both sides."
stress,pressure or tension exerted on a material object.
strict,demanding that rules concerning behaviour are obeyed and observed.
strike,hit forcibly and deliberately with one's hand or a weapon or other implement.
string,"material consisting of threads of cotton, hemp, or other material twisted together to form a thin length."
strong,having the power to move heavy weights or perform other physically demanding tasks.
struck,hit forcibly and deliberately with one's hand or a weapon or other implement.
studio,"a room where an artist, photographer, sculptor, etc. works."
submit,accept or yield to a superior force or to the authority or will of another person.
sudden,occurring or done quickly and unexpectedly or without warning.
suffer,experience or be subjected to (something bad or unpleasant).
summer,"the warmest season of the year, in the northern hemisphere from June to August and in the southern hemisphere from December to February."
summit,the highest point of a hill or mountain.
supply,make (something needed or wanted) available to someone; provide.
surely,used to emphasize the speaker's firm belief that what they are saying is true and often their surprise that there is any doubt of this.
survey,look closely at or examine (someone or something).
switch,a device for making and breaking the connection in an electric circuit.
symbol,"a mark or character used as a conventional representation of an object, function, or process, e.g. the letter or letters standing for a chemical element or a character in musical notation."
system,a set of things working together as parts of a mechanism or an interconnecting network; a complex whole.
taking,the action or process of taking something.
talent,natural aptitude or skill.
target,"a person, object, or place selected as the aim of an attack."
taught,impart knowledge to or instruct (someone) as to how to do something.
tenant,a person who occupies land or property rented from a landlord.
tender,"showing gentleness, kindness, and affection."
tennis,"a game played on a rectangular court by two players or two pairs of players equipped with rackets, in which a ball is driven back and forth over a low net that divides the court in half."
thanks,an expression of gratitude.
theory,"a supposition or a system of ideas intended to explain something, especially one based on general principles independent of the thing to be explained."
thirty,the number equivalent to the product of three and ten; ten less than forty; 30.
though,despite the fact that; although.
threat,"a statement of an intention to inflict pain, injury, damage, or other hostile action on someone in retribution for something done or not done."
thrown,propel (something) with force through the air by a movement of the arm and hand.
ticket,"a piece of paper or card that gives the holder a certain right, especially to enter a place, travel by public transport, or participate in an event."
timely,done or occurring at a favourable or useful time; opportune.
timing,"the choice, judgement, or control of when something should be done."
tissue,Biology. 
toward,going on; in progress.
travel,"go from one place to another, typically over a distance of some length."
treaty,a formally concluded and ratified agreement between states.
trying,difficult or annoying; hard to endure.
twelve,equivalent to the product of three and four; two more than ten; 12.
twenty,the number equivalent to the product of two and ten; ten less than thirty; 20.
unable,"lacking the skill, means, or opportunity to do something."
unique,being the only one of its kind; unlike anything else.
united,"joined together politically, for a common purpose, or by common feelings."
unless,except if (used to introduce the case in which a statement being made is not true or valid).
unlike,different from; not similar to.
update,make (something) more modern or up to date.
useful,able to be used for a practical purpose or in several ways.
valley,"a low area of land between hills or mountains, typically with a river or stream flowing through it."
varied,incorporating a number of different types or elements; showing variation or variety.
vendor,"a person or company offering something for sale, especially a trader in the street."
versus,against (especially in sporting and legal use).
victim,"a person harmed, injured, or killed as a result of a crime, accident, or other event or action."
vision,the faculty or state of being able to see.
visual,relating to seeing or sight.
volume,a book forming part of a work or series.
walker,"a person who walks, especially for exercise or enjoyment."
wealth,an abundance of valuable possessions or money.
weekly,"done, produced, or occurring once a week."
weight,"a body's relative mass or the quantity of matter contained by it, giving rise to a downward force; the heaviness of a person or thing."
wholly,entirely; fully.
window,"an opening in the wall or roof of a building or vehicle, fitted with glass in a frame to admit light or air and allow people to see out."
winner,a person or thing that wins something.
winter,"the coldest season of the year, in the northern hemisphere from December to February and in the southern hemisphere from June to August."
within,inside (something).
wonder,"a feeling of amazement and admiration, caused by something beautiful, remarkable, or unfamiliar."
worker,a person who does a specified type of work or who works in a specified way.
wright,"a worker, especially a constructive worker (used chiefly in combination): a wheelwright; a playwright."
writer,a person who has written something or who writes in a particular way.
yellow,"of the colour between green and orange in the spectrum, a primary subtractive colour complementary to blue; coloured like ripe lemons or egg yolks."
